{
  "$schema": "https://json-schema.org/draft/2020-12/schema",
  "$id": "https://raw.githubusercontent.com/getsentry/MobileBuildMCP/main/schemas/structured-output/mobilebuildmcp.output.scheme-list/2.schema.json",
  "type": "object",
  "additionalProperties": false,
  "allOf": [
    {
      "$ref": "https://raw.githubusercontent.com/getsentry/MobileBuildMCP/main/schemas/structured-output/_defs/common.schema.json#/$defs/errorConsistency"
    }
  ],
  "properties": {
    "schema": {
      "const": "mobilebuildmcp.output.scheme-list"
    },
    "schemaVersion": {
      "const": "2"
    },
    "didError": {
      "type": "boolean"
    },
    "error": {
      "type": [
        "string",
        "null"
      ]
    },
    "data": {
      "type": "object",
      "additionalProperties": false,
      "properties": {
        "artifacts": {
          "oneOf": [
            {
              "type": "object",
              "additionalProperties": false,
              "properties": {
                "workspacePath": {
                  "type": "string"
                }
              },
              "required": [
                "workspacePath"
              ]
            },
            {
              "type": "object",
              "additionalProperties": false,
              "properties": {
                "projectPath": {
                  "type": "string"
                }
              },
              "required": [
                "projectPath"
              ]
            }
          ]
        },
        "schemes": {
          "type": "array",
          "items": {
            "type": "string"
          }
        },
        "diagnostics": {
          "$ref": "https://raw.githubusercontent.com/getsentry/MobileBuildMCP/main/schemas/structured-output/_defs/common.schema.json#/$defs/basicDiagnostics"
        }
      },
      "required": [
        "artifacts",
        "schemes"
      ]
    },
    "nextSteps": {
      "$ref": "https://raw.githubusercontent.com/getsentry/MobileBuildMCP/main/schemas/structured-output/_defs/common.schema.json#/$defs/nextSteps"
    }
  },
  "required": [
    "schema",
    "schemaVersion",
    "didError",
    "error",
    "data"
  ]
}
